{
  "schema_version": "1.0.0",
  "model_id": "nextops-qwen3-5-122b-a10b-q5-k-m",
  "status": "provisioning_unselected",
  "source_repository": "https://huggingface.co/bartowski/Qwen_Qwen3.5-122B-A10B-GGUF",
  "source_revision": "fec8b222a2eddc3346d6b6d7f7c85efea93cd6bf",
  "upstream_repository": "https://huggingface.co/Qwen/Qwen3.5-122B-A10B",
  "upstream_reference_revision": "dc4d348443bc740c68e2d77492492c11606384d5",
  "conversion_source_revision_verified": false,
  "conversion_provenance": "quantizer_declares_base_model_only_exact_conversion_revision_unverified",
  "quantized_by": "bartowski",
  "quantization": "Q5_K_M",
  "expected_architecture": "qwen35moe",
  "total_size_bytes": 90429454752,
  "shards": [
    {
      "filename": "Qwen_Qwen3.5-122B-A10B-Q5_K_M/Qwen_Qwen3.5-122B-A10B-Q5_K_M-00001-of-00003.gguf",
      "size_bytes": 39714874144,
      "sha256": "d7d5aa3ef843ba3fe5ee27cdaebe17abd8a6a8a03a5c236db9bfe2fc6b88be2e"
    },
    {
      "filename": "Qwen_Qwen3.5-122B-A10B-Q5_K_M/Qwen_Qwen3.5-122B-A10B-Q5_K_M-00002-of-00003.gguf",
      "size_bytes": 39467759904,
      "sha256": "9289c968c67237f81f1ffae183cd513b2bc703cfeb47fa4ec7006898622aefca"
    },
    {
      "filename": "Qwen_Qwen3.5-122B-A10B-Q5_K_M/Qwen_Qwen3.5-122B-A10B-Q5_K_M-00003-of-00003.gguf",
      "size_bytes": 11246820704,
      "sha256": "452168a4606657975060e78c59cf2a7eeed7d0774d2ff65aa4aa3eba742965ea"
    }
  ],
  "license": {
    "identifier": "Apache-2.0",
    "source": "https://huggingface.co/Qwen/Qwen3.5-122B-A10B/blob/dc4d348443bc740c68e2d77492492c11606384d5/LICENSE",
    "size_bytes": 11544,
    "sha256": "bbedc3fda3305820b977265f01b8619d87570a6739de3a5582c3464840f1e57a",
    "scope": "pinned_upstream_weight_license_and_quantizer_declared_license_metadata"
  },
  "runtime_commit": "b29c606e28a01b1bc8c1351026a0fa6e616bf6c4",
  "cpu_only_required": true,
  "gpu_layers": 0,
  "runtime_download_allowed": false,
  "deployment_selection_allowed": false,
  "public_thinking_enabled": false,
  "private_reasoning_persisted": false,
  "configured_context_tokens": 16384,
  "max_output_tokens": 2048,
  "request_reasoning_budget_tokens": 128,
  "deadline_seconds": 120,
  "max_active_requests": 1,
  "max_queued_requests": 2,
  "qualification": {
    "artifact_import": "partial",
    "actual_gguf_metadata": "not_run",
    "template_tokenization": "not_run",
    "cpu_load": "not_run",
    "standard_semantics": "not_run",
    "thinking_semantics_privacy": "not_run",
    "expanded_context_latency": "not_run",
    "latency_resource_comparison": "not_run",
    "matched_application": "not_run",
    "wan_offline": "not_run",
    "runtime_model_rollback": "not_run",
    "permissive_license_metadata_review": "passed"
  }
}
